crater,diam,lat,lon,approval_date,nombre,origin
Hypatia,38.82,-4.25,22.58,1935,Hipatia de Alejandría,Hypatia of Alexandria; Egyptian mathematician and philosopher (c. 370-415).
Catharina,98.77,-17.98,23.55,1935,Catalina de Alejandría,"St. Catherine of Alexandria; Greek theologian, philosopher (unkn-c. 307)."
Lepaute,16.36,-33.3,-33.69,1935,Nicole-Reine de la Brière Lepaute,Nicole Reine De La Briere; French astronomer (1723-1788).
C. Herschel,13.7,34.48,-31.29,1935,​​​​​​​Caroline Lucrecia Herschel,Caroline Lucretia; British astronomer (1750-1848).
Somerville,17.08,-8.33,64.96,1976,​​​​​​​Mary Fairfax Greig Somerville,"Mary Fairfax; Scottish physicist, mathematician (1780-1872)."
Sheepshanks,23.67,59.24,17.04,1935,​​​​​​​Anne Sheepshanks,Anne; British benefactor (1789-1876).
Bruce,6.14,1.16,0.37,1935,​​​​​​​Catherine Wolfe Bruce,"Catherine Wolfe; American philanthropist, astronomy patron (1816-1900)."
Mitchell,32.15,49.77,20.17,1935,​​​​​​​Maria Mitchell,Maria; American astronomer (1818-1889).
Clerke,6.66,21.68,29.8,1973,​​​​​​​Agnes Mary Clerke,Agnes Mary; British astronomer (1842-1907).
Kovalevskaya,113.71,30.86,-129.44,1970,​​​​​​​Sofía Vasílievna Kovalevskaya,Sofya Vasilyevna; Russian mathematician (1850-1891).
Maunder,53.8,-14.52,-93.88,1970,​​​​​​​Annie Scott Dill Russell Maunder,Annie Scott Dill Russell; British astronomer (1868-1947); Edward Walter; British astronomer (1851-1928).
Fleming,126.37,14.91,109.28,1970,​​​​​​​Williamina Paton Stevens Fleming,"Alexander; British doctor, Nobel laureate (1881-1955); Williamina Paton; Scottish-born American astronomer (1857-1911)."
Cannon,57.58,19.88,81.36,1964,​​​​​​​Annie Jump Cannon,Annie Jump; American astronomer (1863-1941).
Maury,16.58,37.11,39.69,1935,​​​​​​​Antonia Coetana de Paiva Pereira Maury,Matthew Fontaine; American oceanographer (1806-1873); Antonia Caetana de Paiva Pereira; American astronomer (1866-1952).
Leavitt,69.31,-44.86,-139.89,1970,​​​​​​​Henrietta Swan Leavitt,Henrietta Swan; American astronomer (1868-1921).
Blagg,4.97,1.22,1.46,1935,​​​​​​​Mary Adela Blagg,Mary Adela; British astronomer (1858-1944).
Proctor,47.64,-46.43,-5.04,1935,​​​​​​​Mary A. Proctor,Mary; American astronomer (1862-1957).
Sklodowska,125.55,-18.04,96.15,1961,​​​​​​​Marie Sklodowska Curie,"Marie (Madame Curie); Polish physicist, chemist, Nobel laureate (1867-1934)."
Meitner,87.27,-10.87,113.1,1970,​​​​​​​Lise Meitner,Lise; Austrian physicist (1878-1968).
Nöther (Noether),64.8,66.35,-114.18,1970,​​​​​​​Amalie Emmy Noether,Emmy; German mathematician (1882-1935).
Jenkins,37.77,0.37,78.04,1982,​​​​​​​Louise Freeland Jenkins,Louise Freeland; American astronomer (1888-1970).
Bok,43.03,-20.26,-171.58,1979,​​​​​​​Priscilla Fairfield Bok,"Priscilla Fairfield; American astronomer (1896-1975), Bart Jan; Dutch-American astronomer (1906-1983)."
Cori,67.22,-50.48,-152.91,1979,​​​​​​​Gerty Teresa Radnitz Cori,Gerty Theresa Radnitz; Czech-American physiologist; Nobel laureate (1896-1957).
Resnik,22.16,-34.15,-150.84,1988,​​​​​​​Judith Arlene Resnik,Judith Arlene; member of the Challenger crew (1949-1986).
McAuliffe,19.11,-33.24,-149.77,1988,​​​​​​​Sharon Christa McAuliffe,Sharon Christa Corrigan; civilian school teacher member of the Challenger crew (1948-1986).
Chawla,14.25,-42.48,-147.49,2006,​​​​​​​Kalpana Chawla,"Kalpana; American astronaut, Space Shuttle Columbia Mission Specialist (1961-2003)."
Clark,52.11,-38.67,119.35,1970,​​​​​​​Laurel Blair Salton Clark,"Alvan; American astronomer (1804-1887); Alvan G.; American astronomer, optician (1832-1897)."
Tereshkova,31.33,28.21,143.84,1970,​​​​​​​Valentina Vladimirovna Nikolayeva Tereshkova,Valentina Vladimirovna; Soviet cosmonaut (1937-Live).
Tharp,13.45,-30.6,145.63,"Mar 30, 2015",​​​​​​​Marie Tharp,"Marie; Geologist and oceanographer, created first comprehensive map of the ocean floor and is credited with discovering the Mid-Atlantic Ridge (1920-2006)."
Pierazzo,9.29,3.3,-100.24,"May 26, 2015",​​​​​​​Elisabetta Pierazzo,Elisabetta; Italian planetary scientist (1963-2011).
Hildegard,122.0,-51.68,127.74,"Feb 25, 2016",​​​​​​​Hildegard von Bingen,"Hildegard von Bingen; German writer, composer, mystic and visionary. In Germany she is considered the founder of the scientific study of natural history (1098- 1179)."
Vaughan,3.0,-41.41,-171.85,"Oct 16, 2019",​​​​​​​Dorothy Vaughan,Dorothy; American mathematician (1910-2008).
Easley,9.0,-23.69,87.97,"Feb 01, 2021",​​​​​​​Annie Jean Easley,"Annie Jean; American computer scientist, mathematician, and rocket scientist (1933-2011)."
Marvin,4.6,-89.13,-87.78,"Sep 30, 2021",Ursula Marvin,Ursula; American planetary geologist (1921-2018).
Stose,16.7,-86.38,32.13,"Nov 05, 2021",Anna Isabel Jonas Stose,Anna Isabel Jonas; American geologist (1881-1974).
Brill,17.0,-88.27,-93.41,"Apr 18, 2023",Yvonne Brill,Yvonne; Canadian-American rocket scientist (1924-2013).
Burbidge,21.0,-86.35,48.6,"Aug 02, 2023",E. Margaret Burbidge,E. Margaret; British-American observational astronomer and astrophysicist (1919-2020).
Floss,9.0,-84.28,42.27,"Aug 02, 2023",Christine ,Christine; American cosmochemist (1961-2018).
Mirzakhani,5.0,-17.47,85.2,"Mar 04, 2024",Maryam Mirzakhani,"Maryam; Iranian-American mathematician, first female winner of the Fields Medal (1977-2017)."
Rubin,4.0,-82.82,77.65,"Mar 19, 2024",Vera Rubin,Vera; American astronomer (1928-2016).
Lhamu,1.4,-85.92,-1.62,"Jul 29, 2024",Pasang Lhamu Sherpa Lhamu,Pasang Lhamu Sherpa; first Nepalese female sherpa to climb Mount Everest (1961-1993).
Levi-Montalcini,5.0,-40.79,-154.32,"Aug 06, 2024",Rita Levi-Montalcini,Rita; Nobel Prize-winning Italian neurologist (1909-2012).
Perey,1.6,-42.46,-153.69,"Aug 06, 2024",Marguerite Catherine Perey,Marguerite Catherine; French nuclear physicist who discovered the element francium and first woman to be elected to the French Académie des Sciences (1909-1975)).
